ticket_id,department,description,clean_text,tokens,lemmatized,processed_text
83,Data Center,Maintenance team found heat pocket in left side of Pod 3.,maintenance team found heat pocket in left side of pod,"['maintenance', 'found', 'heat', 'pocket', 'left', 'side', 'pod']","['maintenance', 'find', 'heat', 'pocket', 'leave', 'side', 'pod']",maintenance find heat pocket leave side pod
84,Data Center,SNMP polling timeout on firewall 2 after policy update.,snmp polling timeout on firewall after policy update,"['snmp', 'polling', 'timeout', 'firewall', 'policy', 'update']","['snmp', 'poll', 'timeout', 'firewall', 'policy', 'update']",snmp poll timeout firewall policy update
85,Data Center,Backup generator failed to start during last test run.,backup generator failed to start during last test run,"['backup', 'generator', 'failed', 'start', 'last', 'test', 'run']","['backup', 'generator', 'fail', 'start', 'last', 'test', 'run']",backup generator fail start last test run
86,Data Center,APC dashboard shows no data for several battery packs.,apc dashboard shows no data for several battery packs,"['apc', 'dashboard', 'shows', 'data', 'several', 'battery', 'packs']","['apc', 'dashboard', 'show', 'data', 'several', 'battery', 'pack']",apc dashboard show data several battery pack
87,Data Center,Asset tag mismatch detected between rack label and inventory system.,asset tag mismatch detected between rack label and inventory system,"['asset', 'tag', 'mismatch', 'detected', 'rack', 'label', 'inventory', 'system']","['asset', 'tag', 'mismatch', 'detect', 'rack', 'label', 'inventory', 'system']",asset tag mismatch detect rack label inventory system
88,Data Center,Switch firmware is out-of-date and failing compliance checks.,switch firmware is outofdate and failing compliance checks,"['switch', 'firmware', 'outofdate', 'failing', 'compliance', 'checks']","['switch', 'firmware', 'outofdate', 'fail', 'compliance', 'check']",switch firmware outofdate fail compliance check
89,Data Center,Power cabling to rack 9C is routed across cold aisle incorrectly.,power cabling to rack c is routed across cold aisle incorrectly,"['power', 'cabling', 'rack', 'c', 'routed', 'across', 'cold', 'aisle', 'incorrectly']","['power', 'cable', 'rack', 'c', 'rout', 'across', 'cold', 'aisle', 'incorrectly']",power cable rack c rout across cold aisle incorrectly
90,Data Center,CRAC unit maintenance reminder overdue. Unit hasn't been serviced since Q2.,crac unit maintenance reminder overdue unit has not been serviced since q,"['crac', 'unit', 'maintenance', 'reminder', 'overdue', 'unit', 'serviced', 'since', 'q']","['crac', 'unit', 'maintenance', 'reminder', 'overdue', 'unit', 'service', 'since', 'q']",crac unit maintenance reminder overdue unit service since q
91,Data Center,Air filter replacement needed in Zone A based on airflow drop.,air filter replacement needed in zone a based on airflow drop,"['air', 'filter', 'replacement', 'needed', 'zone', 'based', 'airflow', 'drop']","['air', 'filter', 'replacement', 'need', 'zone', 'base', 'airflow', 'drop']",air filter replacement need zone base airflow drop
92,Data Center,Cabinet door sensor not registering open/close state correctly.,cabinet door sensor not registering openclose state correctly,"['cabinet', 'door', 'sensor', 'registering', 'openclose', 'state', 'correctly']","['cabinet', 'door', 'sensor', 'register', 'openclose', 'state', 'correctly']",cabinet door sensor register openclose state correctly
93,Data Center,Server ID tags are peeling off in high humidity zone.,server id tags are peeling off in high humidity zone,"['server', 'id', 'tags', 'peeling', 'high', 'humidity', 'zone']","['server', 'id', 'tag', 'peel', 'high', 'humidity', 'zone']",server id tag peel high humidity zone
94,Data Center,The chiller loop pressure fluctuates every 15 minutes.,the chiller loop pressure fluctuates every minutes,"['chiller', 'loop', 'pressure', 'fluctuates', 'every', 'minutes']","['chiller', 'loop', 'pressure', 'fluctuate', 'every', 'minute']",chiller loop pressure fluctuate every minute
95,Data Center,System showing phantom power draw on circuit B.,system showing phantom power draw on circuit b,"['system', 'showing', 'phantom', 'power', 'draw', 'circuit', 'b']","['system', 'show', 'phantom', 'power', 'draw', 'circuit', 'b']",system show phantom power draw circuit b
96,Data Center,Blower in Pod 6 screeches loudly under load.,blower in pod screeches loudly under load,"['blower', 'pod', 'screeches', 'loudly', 'load']","['blower', 'pod', 'screech', 'loudly', 'load']",blower pod screech loudly load
97,Data Center,Dehumidifier in cold aisle 8 is cycling too frequently.,dehumidifier in cold aisle is cycling too frequently,"['dehumidifier', 'cold', 'aisle', 'cycling', 'frequently']","['dehumidifier', 'cold', 'aisle', 'cycling', 'frequently']",dehumidifier cold aisle cycling frequently
98,Data Center,Leak alarm triggered twice with no physical leak found.,leak alarm triggered twice with no physical leak found,"['leak', 'alarm', 'triggered', 'twice', 'physical', 'leak', 'found']","['leak', 'alarm', 'trigger', 'twice', 'physical', 'leak', 'find']",leak alarm trigger twice physical leak find
99,Data Center,Blade server in rack 10A has dim power LED and doesn’t POST.,blade server in rack a has dim power led and does not post,"['blade', 'server', 'rack', 'dim', 'power', 'led', 'post']","['blade', 'server', 'rack', 'dim', 'power', 'lead', 'post']",blade server rack dim power lead post
100,Data Center,Unexpected reboot on node 12B. Suspected thermal shutdown.,unexpected reboot on node b suspected thermal shutdown,"['unexpected', 'reboot', 'node', 'b', 'suspected', 'thermal', 'shutdown']","['unexpected', 'reboot', 'node', 'b', 'suspect', 'thermal', 'shutdown']",unexpected reboot node b suspect thermal shutdown
